PubmedArticleSet,PubmedArticle,MedlineCitation,PMID,DateRevised,Year,Month,Day,Article,Journal,ISSN,JournalIssue,PubDate,Title,ISOAbbreviation,ArticleTitle,ELocationID,Abstract,AbstractText,AuthorList,Author,LastName,ForeName,Initials,AffiliationInfo,Affiliation,Language,PublicationTypeList,PublicationType,ArticleDate,MedlineJournalInfo,Country,MedlineTA,NlmUniqueID,ISSNLinking,PubmedData,History,PubMedPubDate,Hour,Minute,PublicationStatus,ArticleIdList,ArticleId
,,,9212484,,2011,9,20,,,2008-4072,,,Journal of injury & violence research,J Inj Violence Res,"b'Unintentional childhood injury patterns, odds, and outcomes in Kampala City: an analysis of surveillance data from the National Pediatric Emergency Unit.'",10.5249/jivr.v3i1.56,,"b'Unintentional injuries are common causes of hospital visit by children under 13 years especially boys. Homes, roads and educational facilities are commonest unintentional injury sites. Significant age and gender differences exist in intentional injury causation, characteristics and outcomes. In its current form, our surveillance system seems inefficient in capturing poisoning and drowning. The local prevention priorities could include home, road and school safety; especially dissemination and uptake of proven interventions. Burns should be focus of domestic injury prevention among under-fives. Commercial passenger motorcycles require better regulation and control. '",,,Svanstrom,Leif,L,,"Pincer Group International Ltd, Karolinska Institutet, Department of Public Health Sciences, Social Medicine, Sweden. mmutto@pincergroup.org",eng,,"Research Support, Non-U.S. Gov't",,,Iran,J Inj Violence Res,101535747,2008-2053,,,,6,0,ppublish,,PMC3134920
,,,21482512,,2011,7,2,,,1749-9216,,,Journal of business continuity & emergency planning,J Bus Contin Emer Plan,b'Changing realities in school safety and preparedness.',,,"b'This paper investigates new realities in emergency preparedness and safety for schools and other educational facilities in a budgetary climate where the sector is being asked to do more with fewer resources. The paper provides a guide to overcoming issues connected with staffing levels and apathy, incorporating principles of emergency management in schools, collaboration with other agencies, communications, training and exercises, and the needs of children during emergencies in order to deliver a cohesive emergency management and safety programme.'",,,Hull,Bob,B,,Kansas Center for Safe and Prepared Schools.,eng,,Journal Article,,,England,J Bus Contin Emer Plan,101509784,1749-9216,,,,6,0,ppublish,,T0RV221333564N15
,,,21464544,,2012,9,7,,,1672-7347,,,Zhong nan da xue xue bao. Yi xue ban = Journal of Central South University. Medical sciences,Zhong Nan Da Xue Xue Bao Yi Xue Ban,b'[Investigation of traffic law violations among middle school students in Hunan province and the influencing factors].',10.3969/j.issn.1672-7347.2011.03.007,,b'Only a small proportion of students often or almost always break traffic law or break several traffic laws at the same time. Students with serious traffic law violations should be targeted by school safety education and intervention.',,,Hu,Guoqing,G,,"Department of Epidemiology and Health Statistics, Central South University, Changsha 410078, China.",chi,,"Research Support, Non-U.S. Gov't",,,China,Zhong Nan Da Xue Xue Bao Yi Xue Ban,101230586,1672-7347,,,,6,0,ppublish,,10.3969/j.issn.1672-7347.2011.03.007
,,,21396783,,2011,10,25,,,1879-1409,,,Burns : journal of the International Society for Burn Injuries,Burns,b'Experience from community based childhood burn prevention programme in Bangladesh: implication for low resource setting.',10.1016/j.burns.2011.02.005,,"b'A comprehensive community-based burn prevention framework was developed for rural Bangladesh taking into consideration the magnitude, consequences of burns, risk factors of childhood burn, health seeking behaviour of parents after a burn injury of a child and the perception of community people. This paper explains the comprehensive framework of the childhood burn prevention programme and describes its acceptability, feasibility and sustainability. A number of methodologies were adopted in developing the framework, such as, (i) building up relevant information on childhood burn and prevention methods, (ii) arranging workshops and consultation meetings with experts and related stakeholders and (iii) piloting components of the framework on a small scale. Lack of supervision of the children, hazardous environment at home and the low level awareness about childhood burn and other injuries were identified as the major attributes of childhood burn in Bangladesh. To address these factors ""Triple S"" strategies were identified for the prevention framework. These strategies are: Safe environment. Supervision. Skill development. According to these strategies, home safety, community crche, school safety, formation of community groups and general awareness activities were identified as the different components of the childhood burn prevention framework in rural Bangladesh. The framework was piloted in a small scale to explore its feasibility acceptability and sustainability. The framework was found to be acceptable by the community. It is also expected to be feasible and sustainable as very low cost and locally available technology and resources were utilized in the framework. Large scale piloting is necessary to explore its effectiveness and ability to scale up all over the whole country.'",,,Rahman,F,F,,"Centre for Injury Prevention and Research, Bangladesh. mashreky@ciprb.org",eng,,"Research Support, Non-U.S. Gov't",,,Netherlands,Burns,8913178,0305-4179,,,,6,0,ppublish,,10.1016/j.burns.2011.02.005
,,,21392011,,2011,7,13,,,1746-1561,,,The Journal of school health,J Sch Health,b'School climate factors contributing to student and faculty perceptions of safety in select Arizona schools.',10.1111/j.1746-1561.2010.00579.x,,"b'The findings raise provocative questions about school safety and provide insight into elements that lead to perceptions of safety. Some schools have transcended issues of location and neighborhood to provide an environment perceived as safe. Further study of those schools could provide insights for policy makers, program planners, and educational leaders.'",,,Hernandaz,Diley,D,,"Department of Educational Leadership, University of Arizona, PO Box 210069, Tucson, AZ 85721, USA. boswortk@email.arizona.edu",eng,,Journal Article,,,United States,J Sch Health,0376370,0022-4391,,,,6,0,ppublish,,10.1111/j.1746-1561.2010.00579.x
,,,21223278,,2011,5,6,,,1746-1561,,,The Journal of school health,J Sch Health,b'Low-level violence in schools: is there an association between school safety measures and peer victimization?',10.1111/j.1746-1561.2010.00567.x,,b'Results indicated that school safety measures overall were not associated with decreased reports of low-level violent behaviors related to bullying. More research is needed to further explore what best promotes comprehensive safety in schools.',,,Bossarte,Robert,R,,"Department of Community Medicine, West Virginia University, P.O. Box 9190, Morgantown, WV 26506, USA. jblosnich@hsc.wvu.edu",eng,,Journal Article,,,United States,J Sch Health,0376370,0022-4391,,,,6,0,ppublish,,10.1111/j.1746-1561.2010.00567.x
,,,15054016,,2011,1,5,,,0042-0972,,,The Urban review,Urban Rev,"b'Perceived School and Neighborhood Safety, Neighborhood Violence and Academic Achievement in Urban School Children.'",,,"b""Community and school violence continue to be a major public health problem, especially among urban children and adolescents. Little research has focused on the effect of school safety and neighborhood violence on academic performance. This study examines the effect of the school and neighborhood climate on academic achievement among a population of 3(rd)-5(th) grade students in an urban public school system. Community and school safety were assessed using the School Climate Survey, an annual city-wide assessment of student's perception of school and community safety. Community violence was measured using the Neighborhood Inventory for Environmental Typology, an objective observational assessment of neighborhood characteristics. Academic achievement was measured using the Maryland State Assessment (MSA), a standardized exam given to all Maryland 3(rd)-8(th) graders. School Climate Data and MSA data were aggregated by school and grade. Objective assessments of neighborhood environment and students' self-reported school and neighborhood safety were both strongly associated with academic performance. Increasing neighborhood violence was associated with statistically significant decreases from 4.2%-8.7% in math and reading achievement; increasing perceived safety was associated with significant increases in achievement from 16%-22%. These preliminary findings highlight the adverse impact of perceived safety and community violence exposure on primary school children's academic performance.""",,,Pj,Leaf,L,,"Johns Hopkins University Bloomberg School of Public Health; Department of Mental Health; 624 N. Broadway, 8  floor; Baltimore, MD; 21205.",eng,,Journal Article,,,Netherlands,Urban Rev,100970551,0042-0972,,,,6,0,ppublish,,NIHMS257637
,,,21094397,,2011,3,8,,,1873-3506,,,Journal of school psychology,J Sch Psychol,b'Supportive school climate and student willingness to seek help for bullying and threats of violence.',10.1016/j.jsp.2010.07.001,,"b'This study investigated the relations between student perceptions of support and student willingness to seek help for bullying and threats of violence in a sample of 7318 ninth-grade students from 291 high schools who participated in the Virginia High School Safety Study. Hierarchical linear modeling indicated that students who perceived their teachers and other school staff to be supportive were more likely to endorse positive attitudes toward seeking help for bullying and threats of violence. In schools with more perceived support, there was less of a discrepancy in help-seeking attitudes between girls and boys. Findings suggest that efforts by school staff to provide a supportive climate are a potentially valuable strategy for engaging students in the prevention of bullying and threats of violence.'",,,Fan,Xitao,X,,"Programs in Clinical and School Psychology, University of Virginia, United States. mee6w@virginia.edu",eng,,"Research Support, U.S. Gov't, Non-P.H.S.",,,United States,J Sch Psychol,0050303,0022-4405,,,,6,0,ppublish,,10.1016/j.jsp.2010.07.001
,,,18352984,,2010,10,1,,,1936-9018,,,The western journal of emergency medicine,West J Emerg Med,"b""High school students' perceptions of motivations for cyberbullying: an exploratory study.""",,,"b'Uncovering the motivations for cyberbullying should promote greater understanding of this phenomenon and potentially reduce the interpersonal violence that can result from it. By providing a framework that begins to clarify the internal and external factors motivating the behavior, there is enhanced potential to develop effective preventive interventions to prevent cyberbullying and its negative effects.'",,,Cutts,Hayley,H,,"Georgia State University, Center for School Safety, School Climate, and Classroom Management, Atlanta, GA.",eng,,Journal Article,,,United States,West J Emerg Med,101476450,1936-900X,,,,6,1,ppublish,,PMC2941365
,,,20724436,,2012,1,3,,,1465-3664,,,Journal of tropical pediatrics,J. Trop. Pediatr.,"b'Pattern of injuries among children and adolescents in Riyadh, Saudi Arabia: a household survey.'",10.1093/tropej/fmq073,,b'school safety education and environmental modification should be applied in Riyadh.',,,Kabbash,Abdulmoty,A,,"Research Chair of Epidemiology, Public Health and Environment, Family & Community Medicine Department, College of Medicine, King Saud University, Riyadh, KSA. ashry59@yahoo.co.uk",eng,,"Research Support, Non-U.S. Gov't",,,England,J Trop Pediatr,8010948,0142-6338,,,,6,0,ppublish,,10.1093/tropej/fmq073
,,,20373239,,2010,4,24,,,1538-957X,,,Traffic injury prevention,Traffic Inj Prev,b'Adult pedestrian behavior when accompanying children on the route to school.',10.1080/15389580903548576,,b'Adult pedestrians behave differently when with boys and girls and at different types of road crossing site. Interventions aimed at reducing pedestrian injuries to children may need to take these different everyday experiences into consideration.',,,Stennet,S,S,,"School of Psychology, University of Lincoln, Lincoln, UK. kpfeffer@lincoln.ac.uk",eng,,Journal Article,,,England,Traffic Inj Prev,101144385,1538-9588,,,,6,0,ppublish,,10.1080/15389580903548576
,,,19704048,,2010,7,2,,,1546-8364,,,The Journal of school nursing : the official publication of the National Association of School Nurses,J Sch Nurs,"b'Social environment and problem behavior: perceived school safety, gender, and sexual debut.'",10.1177/1059840509343112,,"b'In 2007, 48% of U.S. students of grades 9 to 12 had experienced sexual debut, 7% before the age of 13 years. Preventing early intercourse, sexually transmitted diseases, adolescent pregnancy, and the loss of educational opportunity are important concerns for nurses and educators. A secondary data analysis of the Youth Risk Behavior Survey (YRBS) 2003 provided data identifying the relationships among age at sexual debut, gender, location of residence, and perceived school safety (PSS) as framed by the theory of problem behavior. Mean age at sexual debut was 14.4 years. Males were younger at sexual debut than females. Students reporting positive PSS were older at sexual debut. Age at sexual debut was significantly associated with PSS, gender, and location of residence. School nurses are positioned to identify evidence-based programs, facilitate the development of collaborative interventions to improve PSS, and change trajectories of sexual activity leading to poor health outcomes in adolescents and health risk behaviors in adults.'",,,Serdar Atav,A,A,,"Capstone College of Nursing, University of Alabama, Tuscaloosa, Alabama, USA.",eng,,Journal Article,,,United States,J Sch Nurs,9206498,1059-8405,,,,6,0,ppublish,,10.1177/1059840509343112
,,,19252063,,2010,1,9,,,1552-6518,,,Journal of interpersonal violence,J Interpers Violence,b'A cluster analytic investigation of school violence victimization among diverse students.',10.1177/0886260509331507,,"b'Despite nationwide improvements in school safety, victimization at school continues and affects the well-being of a significant number of students. This study uses the California Healthy Kids Survey, a statewide surveillance instrument administered to students in grades 7, 9, and 11 in California (N = 70,600) to address the multiple victimization experiences of students at school. The authors identify subgroups of students based on victimization experience; assess how perceptions of being targeted due to bias relate to cluster membership; and relate victimization to perceptions of school safety, depression, grades, truancy, and internal assets. Victimization rates are given across grade, gender, and ethnicity. Cluster analysis reveals five victimization subgroups--nonvictims, polyvictims, and victims who are predominantly sexually harassed, predominantly physically victimized, and predominantly teased. Compared to nonvictims, students who are victimized report worse outcomes on measures of psychosocial adjustment, with polyvictims faring the worst. Victims are more likely to perceive that they are targeted due to their gender or perceived sexual orientation. Implications for research and practice are provided.'",,,Austin,Greg,G,,"University of California, Santa Barbara, CA, USA.",eng,,Journal Article,,,United States,J Interpers Violence,8700910,0886-2605,,,,6,0,ppublish,,10.1177/0886260509331507
,,,19149782,,2009,3,13,,,1746-1561,,,The Journal of school health,J Sch Health,b'An examination of public school safety measures across geographic settings.',10.1111/j.1746-1561.2008.00370.x,,"b'Recognizing the patterns of violence at public high schools, administrators working with students, other school personnel, and community partners may consider more combinations of the safety measures within their institutions together with local resources and services to improve safety and reduce violence.'",,,Song,Holim,H,,"College of Pharmacy and Health Sciences, Health Sciences Department, Texas Southern University, 3100 Cleburne St, Houston, TX 77004, USA.",eng,,Journal Article,,,United States,J Sch Health,0376370,0022-4391,,,,9,0,ppublish,,10.1111/j.1746-1561.2008.00370.x
,,,19086747,,2009,2,20,,,0003-066X,,,The American psychologist,Am Psychol,b'Are zero tolerance policies effective in the schools?: an evidentiary review and recommendations.',10.1037/0003-066X.63.9.852,,"b'Although there can be no dispute that schools must do all that can be done to ensure the safety of learning environments, controversy has arisen about the use of zero tolerance policies and procedures to achieve those aims. In response to that controversy, and to assess the extent to which current practice benefits students and schools, the American Psychological Association convened a task force to evaluate the evidence and to make appropriate recommendations regarding zero tolerance policies and practices. An extensive review of the literature found that, despite a 20-year history of implementation, there are surprisingly few data that could directly test the assumptions of a zero tolerance approach to school discipline, and the data that are available tend to contradict those assumptions. Moreover, zero tolerance policies may negatively affect the relationship of education with juvenile justice and appear to conflict to some degree with current best knowledge concerning adolescent development. To address the needs of schools for discipline that can maintain school safety while maximizing student opportunity to learn, the report offers recommendations for both reforming zero tolerance where its implementation is necessary and for alternative practice to replace zero tolerance where a more appropriate approach is indicated.'",,,Garcia-Vazquez,Enedina,E,,,eng,,Review,,,United States,Am Psychol,0370521,0003-066X,,,,9,0,ppublish,,10.1037/0003-066X.63.9.852
,,,12144364,,2008,7,9,,,1389-4986,,,Prevention science : the official journal of the Society for Prevention Research,Prev Sci,b'Efficacy of a randomized trial of a community and school-based anti-violence media intervention among small-town middle school youth.',10.1007/s11121-008-0096-7,,"b'In a community randomized controlled trial, intervention middle school students from small towns were exposed to a community and school-based anti-violence intervention (""Resolve It, Solve It""). The primary intervention was a media campaign in which local high school students served as models in print, radio, and television PSAs and spearheaded local school and community activities. The media campaign was supported with school and community events that reinforced campaign messages. Tests of recognition and recall indicated widespread exposure to the media intervention. Multiple group latent growth models indicated that relative to control students, intervention students reported significant differences in rates of growth for intent for violence, physical assault against people, verbal victimization, and perceived safety at school. No differences were found for verbal assault, physical assault against objects, physical victimization, or self-efficacy for avoiding violence. When examined by sex, it was determined that results for physical assault against people were obtained only among female students, and changes in verbal victimization and perceived school safety were observed only among male students. These results suggest that a media and reinforcing community intervention led by older peers can alter rates of growth for some measures of violence and associated factors among small-town youth. Further research is indicated to determine how different campaign messages influence students by sex.'",,,Kelly,Kathleen,K,,"Tri-Ethnic Center for Prevention Resarch, Colorado State University, 106 Sage Hall, Fort Collins, CO 80523, USA. rswaim@lamar.colostate.edu",eng,,"Research Support, N.I.H., Extramural",,,United States,Prev Sci,100894724,1389-4986,,,,9,0,ppublish,,10.1007/s11121-008-0096-7
,,,17659222,,2008,7,9,,,1744-859X,,,Annals of general psychiatry,Ann Gen Psychiatry,b'Correlates of weapon carrying among high school students in the United States.',10.1186/1744-859X-7-8,,b'This research identifies factors that are associated with weapon bearing among adolescents in the United States. These factors may be important in the design of interventions aimed at improving school safety and adolescent health.',,,Siziya,Seter,S,,"Department of Community Medicine and Public Health, University of Malawi, College of Medicine, Blantyre, Malawi. muula@email.unc.edu",eng,,Journal Article,,,England,Ann Gen Psychiatry,101236515,1744-859X,,,,9,0,epublish,,PMC2467418
,,,18245188,,2008,7,3,,,1535-7228,,,The American journal of psychiatry,Am J Psychiatry,b'School safety and the partnership between psychiatrists and school personnel.',10.1176/appi.ajp.2008.08030327,,,,,Rappaport,Nancy,N,,,eng,,Letter,,,United States,Am J Psychiatry,0370512,0002-953X,,,,9,0,ppublish,,10.1176/appi.ajp.2008.08030404r
,,,18563996,,2008,6,20,,,1538-7135,,,"Biosecurity and bioterrorism : biodefense strategy, practice, and science",Biosecur Bioterror,b'Conducting a school-based mock drill: lessons learned from one community.',10.1089/bsp.2007.0065,,"b'Notwithstanding the positive benefits of the mock drill, feedback from participating school personnel demonstrated a need to strengthen communication and coordination between school personnel and outside agencies so that future crisis events are handled more effectively.'",,,Mensia-Joseph,Nita,N,,"Department of Pediatrics, Eastern Virginia Medical School, Norfolk, Virginia 23510, USA. allenk@evms.edu",eng,,Journal Article,,,United States,Biosecur Bioterror,101156085,1538-7135,,,,9,0,ppublish,,10.1089/bsp.2007.0065
,,,18338294,,2008,3,14,,,1538-957X,,,Traffic injury prevention,Traffic Inj Prev,"b""Japanese high school students' usage of mobile phones while cycling.""",10.1080/15389580701718389,,"b""Since mobile phone use while riding a bicycle potentially increases crash risk among cyclists, student bicycle commuters should be made aware of this risk. Moreover, they should be informed that cyclists' phone usage while riding is prohibited according to the road traffic law.""",,,Nakahara,Shinji,S,,"Department of Community Health, School of International Health, University of Tokyo, Tokyo, Japan. masao@md.tsukuba.ac.jp",eng,,"Research Support, Non-U.S. Gov't",,,England,Traffic Inj Prev,101144385,1538-9588,,,,9,0,ppublish,,10.1080/15389580701718389
,,,17195728,,2007,12,25,,,1097-6833,,,The Journal of pediatrics,J. Pediatr.,b'Bullying and school safety.',,,"b'Associations between involvement in bullying and academic achievement, psychological distress, and the belief that it is not wrong to take a gun to school reinforce the notion that school environment is interrelated with mental health and school success.'",,,Rivara,Frederick P,FP,,"Department of Genetics and Developmental Medicine, Children's Hospital and Regional Medical Center, University of Washington, Seattle, WA 98105-0371, USA. glew@u.washington.edu.",eng,,"Research Support, N.I.H., Extramural",,,United States,J Pediatr,0375410,0022-3476,,,,9,0,ppublish,,NIHMS521128
,,,17996655,,2007,11,13,,,1540-2487,,,Disaster management & response : DMR : an official publication of the Emergency Nurses Association,Disaster Manag Response,"b""Affected parents' and other stakeholders' perception of a fire disaster management in India: a situational analysis.""",,,"b'While the participants in the study perceived the management of the disaster as highly satisfactory, several disaster management elements, particularly disaster mental health services, require further attention at all levels.'",,,Walia,Ajinder,A,,"National Institute of Disaster Management, New Delhi, India. satapathysujata@yahoo.co.in",eng,,Journal Article,,,United States,Disaster Manag Response,101155781,1540-2495,,,,9,0,ppublish,,10.1016/j.dmr.2007.08.002
,,,17961690,,2007,10,27,,,1097-6833,,,The Journal of pediatrics,J. Pediatr.,b'Protective factors and suicide risk in adolescents with a history of sexual abuse.',,,"b'Modifying select protective factors, particularly family connectedness, may reduce suicide risk in adolescents with childhood sexual abuse.'",,,Resnick,Michael D,MD,,"Healthy Youth Development Prevention Research Center, Division of Adolescent Health and Medicine, Department of Pediatrics, University of Minnesota Minneapolis, Minnesota 55455, USA. eisen012@umn.edu",eng,,"Research Support, U.S. Gov't, P.H.S.",,,United States,J Pediatr,0375410,0022-3476,,,,9,0,ppublish,,10.1016/j.jpeds.2007.04.033
