PubmedArticleSet,PubmedArticle,MedlineCitation,PMID,DateRevised,Year,Month,Day,Article,Journal,ISSN,JournalIssue,PubDate,Title,ISOAbbreviation,ArticleTitle,ELocationID,Abstract,AbstractText,AuthorList,Author,LastName,ForeName,Initials,AffiliationInfo,Affiliation,Language,PublicationTypeList,PublicationType,ArticleDate,MedlineJournalInfo,Country,MedlineTA,NlmUniqueID,ISSNLinking,PubmedData,History,PubMedPubDate,Hour,Minute,PublicationStatus,ArticleIdList,ArticleId
,,,30395769,,2018,11,6,,,1532-2491,,,Substance use & misuse,Subst Use Misuse,b'Multiple Marginality and the Variation in Delinquency and Substance use Among Adolescent Gang Members.',10.1080/10826084.2018.1528465,,b'Family and school factors are likely important protective factors against delinquency and substance use among gang members. Interventions at the family and community level may be particularly important in reducing poor health and social outcomes for adolescent gang members.',,,Dickson-Gomez,Julia,J,,"a Department of Psychiatry and Behavioral Medicine, Medical College of Wisconsin , Center for AIDS Intervention Research (CAIR) , Milwaukee , Wisconsin , USA.",eng,,Journal Article,,,England,Subst Use Misuse,9602153,1082-6084,,,,6,0,aheadofprint,,10.1080/10826084.2018.1528465
,,,30328371,,2018,10,18,,,1552-6518,,,Journal of interpersonal violence,J Interpers Violence,b'Exploring the Utility of Theory-Informed Methodological Approaches in Youth Harassment Research.',10.1177/0886260518803607,,"b'In comparison to research on youth bullying, less research has been dedicated to youth harassment experiences in school. This study seeks to illustrate youth harassment experiences in school through three theoretically informed methodological approaches to modeling youth victimization: binary, cumulative risk, and attributional approaches. Data come from the 2015 Vermont School Climate Pilot Survey ( N = 2,589 students). Students with complete harassment information ( N = 2,481) were included. Using theoretically informed methodological approaches, regression models examined the associations between experiencing harassment (binary, attributions, and cumulative) and school connection, safety, and equity. About 16% of the sample experienced some form of harassment during the current school year (2014-2015). The most prominent attributions of harassment include weight (40%), sex (27%), and race (22%). After controlling for sociodemographics, ever experiencing harassment was associated with lower school safety, -0.73 (), p < .001, lower connection with school, -0.52 (), p < .001, and lower perceived equity, -0.77 (), p < .001. Experiencing harassment is negatively related to school climate. The results from these analyses underscore the negative relationship among harassment victimization and several important indicators of school climate including student connection, perceived safety at and to/from school, and perceived equity of school. Theoretically informed methodological approaches in youth harassment research should be advanced to comprehensively assess the relationship between harassment victimization and harassment attributes on the social, academic, and behavioral development of youth.'",,,Brion-Meisels,Gretchen,G,,"2 Harvard Graduate School of Education, Cambridge, MA, USA.",eng,,Journal Article,,,United States,J Interpers Violence,8700910,0886-2605,,,,6,0,aheadofprint,,10.1177/0886260518803607
,,,30241657,,2018,9,23,,,2352-7226,,,Sleep health,Sleep Health,"b'Perceived school safety, perceived neighborhood safety, and insufficient sleep among adolescents.'",10.1016/j.sleh.2018.07.006,,b'The findings of this study indicate that efforts to improve the safety of salient social contexts in which adolescents develop may reduce the likelihood of insufficient sleep faced by a large portion of school-aged children.',,,Ammons-Blanfort,Candice,C,,"Florida International University, Department of Criminology and Criminal Justice, 11200 SW 8th Street, PCA-257, Miami, FL. 33199.",eng,,Journal Article,,,United States,Sleep Health,101656808,2352-7218,,,,6,0,ppublish,,10.1016/j.sleh.2018.07.006
,,,30218722,,2018,9,16,,,1096-0260,,,Preventive medicine,Prev Med,b'The impact of positive contextual factors on the association between adverse family experiences and obesity in a National Survey of Children.',10.1016/j.ypmed.2018.09.002,,"b""Adverse family experiences (AFEs) are associated with childhood obesity. We evaluated whether certain positive contextual factors reduce the risk of obesity and overweight among children exposed to AFEs in a nationally representative sample. Using data derived from the National Survey of Children's Health 2011-12 (N=43,864), we calculated the distribution of positive contextual factors (very good/excellent maternal mental health, neighborhood and school safety, and child resilience) and AFEs across weight status. The AFEs composite score was modeled as a categorical measure (0 or 1 AFEs). Positive contextual factors, AFEs and their interactions were evaluated in weighted, adjusted, multinomial logistic regression models predicting the odds of overweight and obesity. Children exposed to lack of very good/excellent maternal mental health and at least one AFE were at risk for overweight (OR=1.43; 95% CI: 1.16, 1.76) and obesity (OR=1.53; 95% CI: 1.22, 1.93). Unsafe school or neighborhood environment and exposure to 1 or more AFEs was. associated with overweight (OR=1.32; 95% CI: 1.08, 1.61) and obesity (OR=1.66; 95% CI: 1.34, 2.05). Lack of child resilience and exposure to 1 or more AFEs was associated with an increased risk of obesity (OR=1.45; 95% CI: 1.17, 1.90) and overweight (OR=1.29; 95% CI: 1.06, 1.57). These odds of obesity and overweight all decreased when positive contextual factors were present. Among children exposed to AFEs, overweight and obesity risk is reduced with positive contextual factors. Optimizing the early childhood environment can impact obesity risk.""",,,Agunwamba,Amenah,A,,"Department of Health Sciences Research, Robert D. and Patricia E. Kern Center for the Science of Health Care Delivery, Mayo Clinic, 200 First Street SW, Rochester, MN 55905, USA. Electronic address: agunwamba.amenah@mayo.edu.",eng,,Journal Article,,,United States,Prev Med,0322116,0091-7435,,,,6,0,ppublish,,10.1016/j.ypmed.2018.09.002
,,,30197197,,2018,9,11,,,1879-1972,,,The Journal of adolescent health : official publication of the Society for Adolescent Medicine,J Adolesc Health,"b""Surveillance or Safekeeping? How School Security Officer and Camera Presence Influence Students' Perceptions of Safety, Equity, and Support.""",10.1016/j.jadohealth.2018.06.008,,"b'Our findings may suggest that outside cameras and security may be perceived by students as safekeeping, whereas inside cameras may evoke feelings of being viewed as potential perpetrators who need surveillance.'",,,Bradshaw,Catherine P,CP,,"School of Education, University of Virginia, Charlottesville, Virginia. Electronic address: Catherine.Bradshaw@virginia.edu.",eng,,Journal Article,,,United States,J Adolesc Health,9102136,1054-139X,,,,6,0,ppublish,,10.1016/j.jadohealth.2018.06.008
,,,14583691,,2018,7,14,,,1872-7123,,,Psychiatry research,Psychiatry Res,b'Connections that moderate risk of non-suicidal self-injury among transgender and gender non-conforming youth.',10.1016/j.psychres.2018.06.068,,"b'We examined associations between social connections and non-suicidal self-injury (NSSI) among transgender/gender non-conforming (TGNC) youth. Data came from the 2016 Minnesota Student Survey (N=2168). Logistic regression analyses determined connectedness factors associated with any past-year NSSI and repetitive NSSI, as well as moderating effects of significant connectedness factors on different risk factors. Almost 55% of TGNC students engaged in NSSI, and 40% of self-injurers reported repetitive self-injury. Parent connectedness, connections to non-parental adults, and school safety emerged as robust protective factors. Strategies to prevent/reduce NSSI should focus on fostering connections with prosocial adults, and ensuring schools represent safe places.'",,,Eisenberg,Marla E,ME,,"Division of General Pediatrics and Adolescent Health, Department of Pediatrics, University of Minnesota, Minneapolis, MN, United States.",eng,,Journal Article,,,Ireland,Psychiatry Res,7911385,0165-1781,,,,6,0,ppublish,,NIHMS1500088
,,,29989188,,2018,7,11,,,1539-6924,,,Risk analysis : an official publication of the Society for Risk Analysis,Risk Anal.,b'Interdisciplinary Approaches to Examining Postdisaster School Recovery.',10.1111/risa.13137,,"b'This perspectives article uses a postdisaster school recovery research domain to examine two tenets of interdisciplinary research (IDR): integrative problem formulation and synthesis. Advancing interdisciplinary knowledge requires a ""roadmap"" of commonalities between disciplinary domains and outcomes of interest. Four school recovery domains-child trauma, educational learning outcomes, school safety, and household and community recovery-are presented to highlight common frameworks for IDR. A case study is also used to illustrate the value of interdisciplinary research and mixed-methods approaches, including statistics, geospatial analysis, and spatial statistics, for answering questions regarding how school contexts and location influence school recovery patterns.'",,,Lai,Betty,B,,"Department of Counseling, Developmental, and Educational Psychology, Lynch School of Education, Boston College, Chestnut Hill, MA, USA.",eng,,Journal Article,,,United States,Risk Anal,8109978,0272-4332,,,,6,0,aheadofprint,,10.1111/risa.13137
,,,29986627,,2018,7,11,,,1546-8364,,,The Journal of school nursing : the official publication of the National Association of School Nurses,J Sch Nurs,b'School Safety.',10.1177/1059840518782215,,,,,McDonald,Catherine C,CC,,"University of Pennsylvania, School of Nursing, Member of the Editorial Advisory Board, The Journal of School Nursing.",eng,,Journal Article,,,United States,J Sch Nurs,9206498,1059-8405,,,,6,0,ppublish,,10.1177/1059840518782215
,,,25773320,,2018,7,3,,,1573-2827,,,Clinical child and family psychology review,Clin Child Fam Psychol Rev,"b""Building Schools' Readiness to Implement a Comprehensive Approach to School Safety.""",10.1007/s10567-018-0264-7,,"b'Research consistently finds that a comprehensive approach to school safety, which integrates the best scientific evidence and solid implementation strategies, offers the greatest potential for preventing youth violence and promoting mental and behavioral health. However, schools and communities encounter enormous challenges in articulating, synthesizing, and implementing all the complex aspects of a comprehensive approach to school safety. This paper aims to bridge the gap between scientific evidence and the application of that evidence in schools and communities by defining the key components of a comprehensive approach to school safety and describing how schools can assess their readiness to implement a comprehensive approach. We use readiness and implementation data from the Safe Communities Safe Schools project to illustrate these challenges and solutions. Our findings suggest that (1) readiness assessment can be combined with feasibility meetings to inform school selection for implementation of a comprehensive approach to school safety and (2) intentionally addressing readiness barriers as part of a comprehensive approach may lead to improvements in readiness (motivation and capacity) to effectively implement a comprehensive approach to school safety.'",,,Elliott,Delbert,D,,"Center for the Study and Prevention of Violence, Institute of Behavioral Science, University of Colorado Boulder, 1440 15th Street, Boulder, CO, 80302, USA.",eng,,Review,,,United States,Clin Child Fam Psychol Rev,9807947,1096-4037,,,,6,0,ppublish,,10.1007/s10567-018-0264-7
,,,29389173,,2018,6,28,,,1573-6695,,,Prevention science : the official journal of the Society for Prevention Research,Prev Sci,b'Evaluation of the Olweus Bully Prevention Program in an Urban School System in the USA.',10.1007/s11121-018-0923-4,,"b""This study evaluated the Olweus Bully Prevention Program (OBPP) in urban middle schools serving a mostly African American student population. Participants were 1791 students from three communities with high rates of crime and poverty. We evaluated the impact of the OBPP using a multiple-baseline experimental design in which we randomized the order and timing of intervention activities across three schools. We assessed the frequency of violence and victimization using self-report and teachers' ratings of students collected every 3months over 5years. Initiation of the OBPP was associated with reductions in teachers' ratings of students' frequency of aggression, with effects emerging in different years of implementation for different forms of aggression. Whereas reductions in teachers' ratings of students' verbal and relational aggression and victimization were evident during the second implementation year, reductions in physical aggression did not appear until the third year. Effects were consistent across gender and schools, with variability across grades for relational and verbal aggression and victimization. In contrast, there were no intervention effects on students' reports of their behavior. Positive outcomes for teachers', but not students' ratings, suggest the intervention's effects may have been limited to the school context. Variation in when effects emerged across outcomes suggests that changes in physical aggression may require more sustained intervention efforts. The intervention was also associated with increases in teachers' concerns about school safety problems, which may indicate that teachers were more attuned to recognizing problem behaviors following exposure to the OBPP.""",,,Masho,Saba,S,,"Department of Family Medicine and Population Health, School of Medicine, Virginia Commonwealth University, Richmond, VA, 23298-0212, USA.",eng,,Journal Article,,,United States,Prev Sci,100894724,1389-4986,,,,6,0,ppublish,,10.1007/s11121-018-0923-4
,,,29927619,,2018,6,22,,,1538-957X,,,Traffic injury prevention,Traffic Inj Prev,b'School safe driving climate: Theoretical and practical considerations for promoting teen driver safety in school settings.',10.1080/15389588.2018.1476689,,"b'Safe driving climate may be an important, modifiable, and measurable aspect of school climate. Additional research is needed to refine the assessment tool and to use it in longitudinal and experimental studies.'",,,Higgins-D'Alessandro,Ann,A,,"b Department of Psychology , Fordham University , Bronx , New York.",eng,,Journal Article,,,England,Traffic Inj Prev,101144385,1538-9588,,,,6,0,ppublish,,10.1080/15389588.2018.1476689
,,,29847288,,2018,5,31,,,1547-0679,,,Journal of child sexual abuse,J Child Sex Abus,b'Preventing School Employee Sexual Misconduct: An Outcome Survey Analysis of Making Right Choices.',10.1080/10538712.2018.1477002,,"b'This treatment-only study examines the impact of Making Right Choices, an online course prevention program designed to promote the knowledge, awareness, and prevention of school employee sexual misconduct. The sample included 13,007 school employee participants who took the Making Right Choices course between May 6, 2011, and March 12, 2017, in California and New York. The 20-item measure, Preventing Misconduct Assessment, was administered to participants at the end of the online course; completion of the measure was voluntary. Descriptive statistics revealed that a large majority of participants reported increasing their knowledge and awareness of school employee sexual misconduct because of their participation in the Making Right Choices online course. This study yields important findings regarding the impact of a sexual misconduct prevention program and, specifically, the difference it may make for non-licensed school employees. These findings indicate that school employees are accepting of sexual misconduct training programs and rate them as having value.'",,,Sonnich,Steve,S,,"a Private Practice , San Diego , USA.",eng,,Journal Article,,,United States,J Child Sex Abus,9301157,1053-8712,,,,6,0,aheadofprint,,10.1080/10538712.2018.1477002
,,,29784550,,2018,5,23,,,1618-131X,,,International journal of hygiene and environmental health,Int J Hyg Environ Health,"b'School environmental conditions and links to academic performance and absenteeism in urban, mid-Atlantic public schools.'",10.1016/j.ijheh.2018.04.015,,"b""School facility conditions, environment, and perceptions of safety and learning have been investigated for their impact on child development. However, it is important to consider how the environment separately influences academic performance and attendance after controlling for school and community factors. Using results from the Maryland School Assessment, we considered outcomes of school-level proficiency in reading and math plus attendance and chronic absences, defined as missing 20 or more days, for grades 3-5 and 6-8 at 158 urban schools. Characteristics of the environment included school facility conditions, density of nearby roads, and an index industrial air pollution. Perceptions of school safety, learning, and institutional environment were acquired from a School Climate Survey. Also considered were neighborhood factors at the community statistical area, including demographics, crime, and poverty based on school location. Poisson regression adjusted for over-dispersion was used to model academic achievement and multiple linear models were used for attendance. Each 10-unit change in facility condition index, denoting worse quality buildings, was associated with a decrease in reading (1.0% (95% CI: 0.1-1.9%) and math scores (0.21% (95% CI: 0.20-0.40), while chronic absences increased by 0.75% (95% CI: 0.30-1.39). Each log increase the EPA's Risk Screening Environmental Indicator (RSEI) value for industrial hazards, resulted in a marginally significant trend of increasing absenteeism (p<0.06), but no association was observed with academic achievement. All results were robust to school-level measures of racial composition, free and reduced meals eligibility, and community poverty and crime. These findings provide empirical evidence for the importance of the community and school environment, including building conditions and neighborhood toxic substance risk, on academic achievement and attendance.""",,,Curriero,F C,FC,,"Department of Epidemiology, Johns Hopkins Bloomberg School of Public Health, Baltimore, MD, United States. Electronic address: fcurriero@jhu.edu.",eng,,Journal Article,,,Germany,Int J Hyg Environ Health,100898843,1438-4639,,,,6,0,ppublish,,10.1016/j.ijheh.2018.04.015
,,,21381837,,2018,5,2,,,1573-6709,,,The Psychiatric quarterly,Psychiatr Q,b'Automated Risk Assessment for School Violence: a Pilot Study.',10.1007/s11126-018-9581-8,,"b""School violence has increased over the past ten years. This study evaluated students using a more standard and sensitive method to help identify students who are at high risk for school violence. 103 participants were recruited through Cincinnati Children's Hospital Medical Center (CCHMC) from psychiatry outpatient clinics, the inpatient units, and the emergency department. Participants (ages 12-18) were active students in 74 traditional schools (i.e. non-online education). Collateral information was gathered from guardians before participants were evaluated. School risk evaluations were performed with each participant, and audio recordings from the evaluations were later transcribed and manually annotated. The BRACHA (School Version) and the School Safety Scale (SSS), both 14-item scales, were used. A template of open-ended questions was also used. This analysis included 103 participants who were recruited from 74 different schools. Of the 103 students evaluated, 55 were found to be moderate to high risk and 48 were found to be low risk based on the paper risk assessments including the BRACHA and SSS. Both the BRACHA and the SSS were highly correlated with risk of violence to others (Pearson correlations>0.82). There were significant differences in BRACHA and SSS total scores between low risk and high risk to others groups (p-values <0.001 under unpaired t-test). In particular, there were significant differences in individual SSS items between the two groups (p-value <0.001). Of these items, Previous Violent Behavior (Pearson Correlation=0.80), Impulsivity (0.69), School Problems (0.64), and Negative Attitudes (0.61) were positively correlated with risk to others. The novel machine learning algorithm achieved an AUC of 91.02% when using the interview content to predict risk of school violence, and the AUC increased to 91.45% when demographic and socioeconomic data were added. Our study indicates that the BRACHA and SSS are clinically useful for assessing risk for school violence. The machine learning algorithm was highly accurate in assessing school violence risk.""",,,DelBello,Melissa,M,,"University of Cincinnati, Cincinnati, USA.",eng,,Journal Article,,,United States,Psychiatr Q,0376465,0033-2720,,,,6,0,ppublish,,10.1007/s11126-018-9581-8
,,,29621930,,2018,4,7,,,1546-8364,,,The Journal of school nursing : the official publication of the National Association of School Nurses,J Sch Nurs,"b'Violence in Rural, Suburban, and Urban Schools in Pennsylvania.'",10.1177/1059840518765086,,"b'School violence is a public health issue with direct and collateral consequences that has academic and social impacts for youth. School violence is often considered a uniquely urban problem, yet more research is needed to understand how violence in rural and suburban schools may be similar or different from urban counterparts. Using school violence data from a state with urban, suburban, and rural counties, we explored the landscape of school violence in Pennsylvania (PA) through mapping, descriptive statistics, and factor analysis. Results show school violence is not solely an urban problem. Schools in all county types and across grade levels deal with violence to varying degrees, and the majority of schools across county types experience low levels of violence. Types of violence experienced by PA schools loaded onto three factors, suggesting that targeted interventions may be better suited to addressing school violence.'",,,Wiebe,Douglas J,DJ,,"3 Department of Biostatistics and Epidemiology, Perelman School of Medicine, University of Pennsylvania, Philadelphia, PA, USA.",eng,,Journal Article,,,United States,J Sch Nurs,9206498,1059-8405,,,,6,0,ppublish,,10.1177/1059840518765086
,,,21433031,,2018,3,20,,,1573-6601,,,Journal of youth and adolescence,J Youth Adolesc,"b""School Security Measures and Longitudinal Trends in Adolescents' Experiences of Victimization.""",10.1007/s10964-018-0818-5,,"b""Although school security measures have become a common fixture in public schools across the United States, research on the relationship between security and adolescent victimization is mixed, with very few studies examining trends in adolescent victimization across time. Using two waves of data from the Educational Longitudinal Study 2002 (N=7659; 50.6% female; 56.7% White, 13.3% Black, 13.5% Hispanic, 11.3% Asian American, 5.4% other race), results from a series of multi-level models demonstrate that adolescents in schools with more security measures report higher odds of being threatened with harm, and no difference in odds of being in a physical altercation or having something stolen over time. Although prior research has established racial disparities in using school security measures, results demonstrate inconsistent patterns in the extent to which adolescents' race conditions the relationship between security and victimization. The findings are discussed in light of existing theoretical and empirical work, and implications for both research and practice are offered.""",,,Boman,John H,JH,,"Department of Sociology, Bowling Green State University, Bowling Green, OH, 43403, USA. jboman@bgsu.edu.",eng,,Journal Article,,,United States,J Youth Adolesc,0333507,0047-2891,,,,6,0,ppublish,,10.1007/s10964-018-0818-5
,,,29540111,,2018,3,16,,,1546-8364,,,The Journal of school nursing : the official publication of the National Association of School Nurses,J Sch Nurs,b'Sex Differences in School Safety and Bullying Experiences Among Sexual Minority Youth.',10.1177/1059840518762536,,"b'Schools play an integral role in creating safe, supportive environments for students, especially for sexual minority youth (SMY). Using 2016 questionnaire data from seven high schools in a Florida school district, we obtained a sample of 1,364 SMY. Logistic regressions controlling for sex (as applicable), age, grade, race/ethnicity, and school explored differences between SMY and nonsexual minority youth (non-SMY). Sex differences related to school environment perceptions and experiences related to safety, bullying, and hearing homophobic remarks were also explored. SMY were more likely than non-SMY to report several negative school environment perceptions and experiences. Where differences existed within SMY, male SMY were more likely than female SMY to have missed school in the past 30 days (odds ratio [ OR] = 1.66, p = .03), report avoiding spaces at school due to safety concerns ( OR = 1.38, p = .02), and report hearing homophobic remarks from teachers ( OR = 2.00, p = .01). Implications for school nursing are discussed.'",,,Adkins,Susan N Hocevar,SNH,,"2 Centers for Disease Control and Prevention, Division of Adolescent and School Health, Atlanta, GA, USA.",eng,,Journal Article,,,United States,J Sch Nurs,9206498,1059-8405,,,,6,0,ppublish,,10.1177/1059840518762536
